<?xml version="1.0" encoding="UTF-8"?>
<!DOCTYPE ListeMeuble SYSTEM "meuble.dtd">     

<ListeMeuble>
	<Meuble nom='IJFD' ref='001451001' unite='cm' lng='40' lar='20'
		hau='10'>
		<Elmt nom='Pied' num='4' unite='cm' lng='10' lar='2' hau='1'>
			<Materiaux pc='100' type='FER'></Materiaux>
		</Elmt>
		<Elmt nom='Base' num='1' unite='cm' lng='40' lar='20' hau='8'>
			<Materiaux pc='20' type='FER'></Materiaux>
			<Materiaux pc='60' type='BRONZE'></Materiaux>
			<Materiaux pc='20'></Materiaux>
		</Elmt>
		<Notice>
			Ceci est une Notice!
		</Notice>
	</Meuble>
	<Meuble nom='BOLFDNU' ref='001451002' unite='i' lng='102' lar='89'
		hau='7'>
		<Elmt nom='sljak' num='1' unite='cm' lng='25' lar='8' hau='14'>
			<Materiaux pc='63' type='STRATIFIE'></Materiaux>
			<Materiaux pc='27' type='TISSU'></Materiaux>
			<Materiaux pc='10' type='PLASTIQUE'></Materiaux>
		</Elmt>
		<Elmt nom='VKLA' num='2' unite='m' lng='1' lar='0.4' hau='0.01'>
			<Materiaux pc='100' type='VIDE'></Materiaux>
		</Elmt>
	</Meuble>
	<Meuble nom='BLOK' ref='001451015' lng='2500' lar='1587' hau='13650'>
		<Elmt nom='KOLBBLOK' num='1' unite='cm' lng='250' lar='1587' hau='1365'>
			<Materiaux pc='100' type='CARTON'></Materiaux>
		</Elmt>
		<Notice>
			De grandes bandes de Carton. eùoµ
			RLGJ ET
			4
			%REG?JEG
			Z .3TKIZ
			H32+5£KZB DTYA934
			6.EV TZAE3¨£T
			51VKFR3ENUEY494%F.?S FHJZEL
		</Notice>
	</Meuble>
</ListeMeuble>